{
  "as_of": "2026-09-03",
  "source": "USER_ASSUMPTION",
  "accounts": [
    {
      "account_id": "ACC-DEMO-003",
      "balance_krw": 900000
    }
  ],
  "cards": [
    {
      "card_id": "CARD-DEMO-003",
      "kind": "DEBIT",
      "settlement_account_id": "ACC-DEMO-003"
    }
  ],
  "known_bills": [],
  "reserve_krw": 200000,
  "coverage": {
    "all_assets_reported": false,
    "all_liabilities_reported": false
  },
  "budgets": {
    "교통비": 54000,
    "기타": 1644000,
    "쇼핑": 78000,
    "외식": 230000,
    "의료·건강": 43000,
    "취미·여가": 26000,
    "편의점·마트·잡화": 121000
  }
}